[
  {
    "acceptable_claims": [
      "Ayon sa synthetic rule, ang reklamo ay ipinapasa sa discipline office, na magpapaalam sa student sa loob ng limang working days."
    ],
    "adversarial_kinds": [],
    "case_id": "syn-discipline-process-tgl",
    "category": "discipline",
    "expected_control": null,
    "expected_outcome": null,
    "expected_route": "RAG",
    "gold_rules": [],
    "gold_spans": [],
    "group_id": "grp-discipline-info",
    "language": "taglish",
    "missing_facts": [],
    "must_abstain": false,
    "query": "Ano ang proseso kapag may reklamo sa disiplina laban sa isang student?",
    "required_facts": [
      "complaint process"
    ],
    "review": {
      "author": "dev-author",
      "evidence_ref": null,
      "review_version": null,
      "reviewer": null
    },
    "schema_version": "bintanong-evaluation-case-v1",
    "scope": null,
    "scope_null_reason": "synthetic case: no real edition applies",
    "split": "dev",
    "status": "synthetic",
    "synthetic_policy": "Synthetic rule: a complaint goes to the discipline office, which notifies the student within five working days."
  }
]
