[
  {
    "acceptable_claims": [
      "Magkasalungat ang dalawang patakaran at hindi pa naaayos, kaya walang tiyak na sagot."
    ],
    "adversarial_kinds": [
      "conflicting_evidence"
    ],
    "case_id": "syn-discipline-conflict-tl",
    "category": "discipline",
    "expected_control": null,
    "expected_outcome": null,
    "expected_route": "RAG",
    "gold_rules": [],
    "gold_spans": [],
    "group_id": "grp-conflicting-discipline",
    "language": "tl",
    "missing_facts": [],
    "must_abstain": true,
    "query": "Ilang araw ang suspensiyon para sa unang paglabag sa dress code?",
    "required_facts": [
      "current dress code penalty"
    ],
    "review": {
      "author": "dev-author",
      "evidence_ref": null,
      "review_version": null,
      "reviewer": null
    },
    "schema_version": "bintanong-evaluation-case-v1",
    "scope": null,
    "scope_null_reason": "synthetic case: no real edition applies",
    "split": "dev",
    "status": "synthetic",
    "synthetic_policy": "Synthetic rule: two synthetic notices state different penalties and neither supersedes the other."
  }
]
