[
  {
    "acceptable_claims": [
      "Under the synthetic rule, 1.5 or better qualifies for honors, and 1.4 meets it."
    ],
    "adversarial_kinds": [],
    "case_id": "syn-grades-honors-en",
    "category": "grades",
    "expected_control": null,
    "expected_outcome": "eligible",
    "expected_route": "Symbolic",
    "gold_rules": [],
    "gold_spans": [],
    "group_id": "grp-honors-grade-eligibility",
    "language": "en",
    "missing_facts": [],
    "must_abstain": false,
    "query": "My weighted average is 1.4 and the honors cutoff is 1.5 or better. Do I qualify for honors?",
    "required_facts": [
      "weighted average",
      "honors cutoff"
    ],
    "review": {
      "author": "dev-author",
      "evidence_ref": null,
      "review_version": null,
      "reviewer": null
    },
    "schema_version": "bintanong-evaluation-case-v1",
    "scope": null,
    "scope_null_reason": "synthetic case: no real edition applies",
    "split": "dev",
    "status": "synthetic",
    "synthetic_policy": "Synthetic rule: honors need a weighted average of 1.5 or better (lower is better)."
  }
]
